{
  "dataset_name": "uat_end_to_end_cases",
  "version": "1.0.0",
  "description": "Shared 24-question dataset for final-system end-to-end evaluation and role-based UAT. The same questions are evaluated technically using traces and LLM-as-a-Judge, then by users using acceptance metrics.",
  "total_cases": 24,
  "distribution": {
    "role_counts": {
      "dosen": 6,
      "kaprodi": 6,
      "dekan": 6,
      "direktorat": 6
    },
    "analysis_aspect_counts": {
      "academic_performance": 5,
      "portfolio_reflection": 4,
      "program_or_faculty_monitoring": 6,
      "comparative_or_trend_analysis": 5,
      "diagnostic_and_recommendation": 4
    },
    "data_source_mix_counts": {
      "structured": 16,
      "textual": 4,
      "hybrid": 4
    }
  },
  "metrics": {
    "end_to_end": [
      "task_success_rate",
      "correctness",
      "faithfulness",
      "completeness",
      "latency_seconds"
    ],
    "uat": [
      "task_completion",
      "perceived_correctness",
      "usefulness",
      "clarity",
      "trust_and_acceptance"
    ]
  },
  "cases": [
    {
      "id": "UAT-DOS-01",
      "role": "dosen",
      "analysis_aspect": "academic_performance",
      "data_source_mix": "structured",
      "language": "id",
      "domain": "portfolio",
      "question": "Tampilkan ringkasan performa akademik untuk salah satu kelas yang saya ampu, mencakup jumlah mahasiswa, distribusi nilai, kehadiran mahasiswa, dan indikator evaluasi utama.",
      "user_scope": {
        "role": "dosen",
        "requires_live_role_account": true,
        "scope_notes": "Run using a lecturer account that has at least one visible taught class with grade distribution and evaluation data."
      },
      "expected_evidence": {
        "expected_tools": ["sql"],
        "expected_data_sources": ["analitik.v_akademik_kelas"],
        "expected_answer_elements": ["class identity", "student count or graded-student count", "grade distribution", "student attendance", "main evaluation indicators"],
        "prohibited_behavior": ["showing classes outside the lecturer scope", "claiming unsupported causes"]
      },
      "technical_rubric": {
        "task_success_criteria": ["The answer identifies a class in the lecturer scope.", "The answer reports academic performance using multiple indicators, not only evaluation score."],
        "correctness_reference": "Compare the stated indicators with SQL tool output.",
        "faithfulness_reference": "All numeric claims must be supported by tool observations.",
        "completeness_criteria": ["Includes grade distribution or graded-student count.", "Includes attendance.", "Includes evaluation indicators."]
      },
      "acceptance_rubric": {
        "task_completion_prompt": "Can you use this answer to understand the academic condition of one class you teach?",
        "perceived_correctness_prompt": "The answer appears factually reasonable for my class data.",
        "usefulness_prompt": "The answer helps me identify whether the class needs follow-up.",
        "clarity_prompt": "The answer is easy to understand.",
        "trust_acceptance_prompt": "I would use this type of answer as academic monitoring support."
      },
      "validation": {
        "pre_uat_checks": ["Full graph completes.", "SQL evidence is non-empty.", "The selected class belongs to the lecturer scope."],
        "evidence_non_empty_required": true,
        "scope_leakage_check_required": true
      },
      "notes_for_evaluator": "This case tests broader academic performance, not only course evaluation score."
    },
    {
      "id": "UAT-DOS-02",
      "role": "dosen",
      "analysis_aspect": "academic_performance",
      "data_source_mix": "structured",
      "language": "id",
      "domain": "portfolio",
      "question": "Kelas yang saya ampu mana yang memiliki indikasi performa akademik paling perlu diperhatikan berdasarkan kehadiran mahasiswa, distribusi nilai, atau skor evaluasi?",
      "user_scope": {
        "role": "dosen",
        "requires_live_role_account": true,
        "scope_notes": "Run using a lecturer account with more than one visible class if possible."
      },
      "expected_evidence": {
        "expected_tools": ["sql"],
        "expected_data_sources": ["analitik.v_akademik_kelas"],
        "expected_answer_elements": ["prioritized class", "reason for prioritization", "at least two academic indicators"],
        "prohibited_behavior": ["ranking without evidence", "using only one indicator when multiple indicators are available"]
      },
      "technical_rubric": {
        "task_success_criteria": ["The answer prioritizes at least one class.", "The prioritization is justified using academic indicators."],
        "correctness_reference": "Compare class ranking and indicators with SQL output.",
        "faithfulness_reference": "Priority reasoning must be traceable to retrieved indicators.",
        "completeness_criteria": ["Mentions attendance, grade distribution, or evaluation score.", "Explains why the class is prioritized."]
      },
      "acceptance_rubric": {
        "task_completion_prompt": "Can you identify which class needs attention from this answer?",
        "perceived_correctness_prompt": "The prioritization appears consistent with the data.",
        "usefulness_prompt": "The answer helps me decide where to focus follow-up.",
        "clarity_prompt": "The priority and reason are clearly explained.",
        "trust_acceptance_prompt": "I would trust this answer as an initial warning signal."
      },
      "validation": {
        "pre_uat_checks": ["Full graph completes.", "Evidence contains at least one visible class.", "No out-of-scope class is shown."],
        "evidence_non_empty_required": true,
        "scope_leakage_check_required": true
      },
      "notes_for_evaluator": "If the lecturer has only one class, evaluate whether the answer still explains the class condition rather than forcing a ranking."
    },
    {
      "id": "UAT-DOS-03",
      "role": "dosen",
      "analysis_aspect": "portfolio_reflection",
      "data_source_mix": "textual",
      "language": "id",
      "domain": "portfolio",
      "question": "Tampilkan ringkasan metode perkuliahan dan sistem penilaian dari portofolio salah satu kelas yang saya ampu.",
      "user_scope": {
        "role": "dosen",
        "requires_live_role_account": true,
        "scope_notes": "Run using a lecturer account with at least one visible portfolio entry."
      },
      "expected_evidence": {
        "expected_tools": ["sql", "rag"],
        "expected_data_sources": ["analitik.v_akademik_portofolio"],
        "expected_answer_elements": ["teaching method summary", "assessment system summary", "class identity"],
        "prohibited_behavior": ["inventing portfolio content", "summarizing without class identity"]
      },
      "technical_rubric": {
        "task_success_criteria": ["The answer summarizes teaching method and assessment system.", "The summary is grounded in portfolio text."],
        "correctness_reference": "Compare summary against retrieved portfolio text.",
        "faithfulness_reference": "No statement should go beyond portfolio evidence.",
        "completeness_criteria": ["Mentions teaching method.", "Mentions assessment system.", "Identifies the class."]
      },
      "acceptance_rubric": {
        "task_completion_prompt": "Can you understand how the class was conducted and assessed from this answer?",
        "perceived_correctness_prompt": "The summary matches what I expect from the portfolio.",
        "usefulness_prompt": "The answer helps me review my portfolio entry.",
        "clarity_prompt": "The summary is concise and understandable.",
        "trust_acceptance_prompt": "I would use this summary to review portfolio documentation."
      },
      "validation": {
        "pre_uat_checks": ["Portfolio evidence is non-empty.", "Answer does not fabricate missing text.", "Scope matches lecturer role."],
        "evidence_non_empty_required": true,
        "scope_leakage_check_required": true
      },
      "notes_for_evaluator": "Accept either SQL-based portfolio retrieval or RAG retrieval if the final evidence is grounded."
    },
    {
      "id": "UAT-DOS-04",
      "role": "dosen",
      "analysis_aspect": "portfolio_reflection",
      "data_source_mix": "textual",
      "language": "id",
      "domain": "portfolio",
      "question": "Ringkas refleksi pelaksanaan perkuliahan dan usulan perbaikan dosen untuk salah satu kelas yang saya ampu.",
      "user_scope": {
        "role": "dosen",
        "requires_live_role_account": true,
        "scope_notes": "Run using a lecturer account with reflection and improvement-plan text."
      },
      "expected_evidence": {
        "expected_tools": ["sql", "rag"],
        "expected_data_sources": ["analitik.v_akademik_portofolio"],
        "expected_answer_elements": ["reflection summary", "improvement recommendation summary", "class identity"],
        "prohibited_behavior": ["creating recommendations not present in evidence without labeling them as interpretation"]
      },
      "technical_rubric": {
        "task_success_criteria": ["The answer summarizes reflection and improvement plan.", "The answer separates evidence summary from interpretation."],
        "correctness_reference": "Compare summary with portfolio evidence.",
        "faithfulness_reference": "Summary claims must be grounded in retrieved text.",
        "completeness_criteria": ["Includes reflection.", "Includes improvement plan."]
      },
      "acceptance_rubric": {
        "task_completion_prompt": "Can you use this answer to review reflection and follow-up plans?",
        "perceived_correctness_prompt": "The answer reflects the portfolio content accurately.",
        "usefulness_prompt": "The answer helps me evaluate what to improve next.",
        "clarity_prompt": "The reflection and improvement points are clear.",